0,1
4,"we had a light dinner here, it was fantastic! fresh seafood at it's finest. started out with arran smoked salmon with potato scones, cr  me fra  che and chives, the salmon was so fresh, it melted in your mouth. we also split a kg of the scottish mussels, we chose shallots, white wine, garlic   cream sauce, don't forget to order some bread to dip into the pot and soak up the goodness. this was probably one of the best mussels pots i've had. 

call and make a reservation if you can, we waited 45 minutes for a table (we went over to the bow bar to pass the time). if you can, sit outside, great people watching, right in the heart of grassmarket."
5,"the best surf and turf i have ever had. 

i stumbled upon this place by accident during a day trip to edinburgh. it was during scotland's unexpected (and sorely missed) heatwave so we sat outside   a rare treat in our climate. we were the first diners when we sat down but by the time we left the place was full and there was a great vibe. 

now to the food. me and my dad both opted for the same thing   the surf and turf. this consists of a rib eye steak served with half a kilogram of mussels cooked in your choice of sauce, crevettes and squid rings. being a big fan of asian flavours i opted for the chilli, ginger and lime sauce. we also ordered some buttered new potatoes on the side to add some carbohydrate to all the protein.

when the dish arrived it was amazing. perfectly cooked steak (medium rare for me) sitting on a mountain of seafood   not many things could look so appealing. all the seafood was full of flavour, the sauce had just enough heat and the corona with lime just added to an amazing meal.

next time i'm in edinburgh i will definitely be making a return here (i hope the heatwave will too)."
3,"was expecting a lot from this place based on the reviews, but honestly we didnt love it. it was just ok. service was quick and friendly. they were also happy to oblige my dairy intolerance, which was nice. both the seafood and steak were good quality, but i guess they were just a bit boring. 

boyfriend wasnt so keen on the strange warm, limp cabbage on the side of the steak. although the steak was cooked as ordered (medium rare) which was good. the queen scallop starter was ok, but the scallops were quite small and over salted. mussels were pretty good. 

overall a decent meal, but not good enough to get us over to grassmarket on a regular basis."
5,"i don't like mussels.  they are too strong and too fishy! don't care for the smell and don't care for them in soups or stews.  until now i would have told you that i'd rather eat rattlesnake.  appearantly in scottland, there is an entirely different species of mussels.

we stopped in at the mussel and steak bar for dinner before walking up to the castle for the 10 30 tattoo.  our travel mate ordered the mussel starter.  it arrived with green sauce on it.  omg, it smelled amazing.  so much so that i had to taste it.  the little mussels were tender and steamed to perfection with a light pesto sauce driselled over them.  it is such a great combination!

i had the surf and turf for dinner.  the mussels were done in white wine and garlic and the ribeye steak was tender, juicey and cooked exactly as i ordered it. all four of us agreed that our meals were delightful.  the price was not out of line.  service was spot on."
4,"i went here recently for a colleague's leaving lunch. there were 8 of us in our group   it was quite busy. 

we ordered from the lunch menu   1 course   7.95, 2 courses   9.95 or 3 courses   11.95.

most of the group ordered starters   the haggis dish was the most popular. 

i saved myself for the 6oz rump steak which was awesome. the chips were chunky   crispy, just how i like them   the mushrooms were earthy   full of flavour. my steak was perfectly cooked, moist   melt in the mouth. 

a colleague had the seafood curry. it was full of enormous mussels   other fishy delights. it smelled amazing   he said it was the best fish curry he's had. the only problem being that it took so long to arrive he didn't have time to finish it before having to get back to work.

unfortunately the service was slow and i we all had to skip dessert   coffee as we needed to get back to the office (despite being there over 90 mins).

a lovely lunch with great food   company. it was a shame the slow service meant it was a wee bit stressful. the front of house staff were lovely maybe they just need another pair of hands in the kitchen."
4,"fantastic location but very small on the inside, can be a long wait.  the seafood was only slightly above average in freshness and quality, and small portions, so had to knock off one star."
4,"i never fail to enjoy a good feed at the mussel and steak bar. pot of mussels with white wine and garlic sauce does the job perfectly. the ambience is pleasant, but it's better to sit downstairs as the upstairs bit feels a bit empty and lonely i think. 

food is generally lovely. staff are generally lovely. place is generally lovely. go!"
3,"definitely not the classiest joint in town... or maybe it is...?

the tables are old(er) but the felt is still in relatively good shape. some of the cues have cracked tips but if you look, you can usually find one worth playing with. 

monday and tuesdays they have  5 pool from 6pm to 11pm (although i think that's gone up to  6 recently)... either way, you can't complain about that. 

they have a fully stocked bar and will make tea and coffee on request for those of us who don't drink. they also have a half decent menu with food that's prepared downstairs at texas burger (yum).  

you're pretty much in view of a tv wherever you are and they have a large projection tv in the lounge area allowing you to sit, eat and watch the game. 

i'm not saying it doesn't happen but i've never seen a rowdy crowd here and although i've been to better halls, this place is okay for a fun night out."
5,"thank you, finally an audio   video specialist company you can trust and thats not creepy. i was't even planning on putting a home theater system for my house until i talked to jeremy, who was highly recommended by a close friend. long story short he stopped by my house we did a walk through together and he really took his time to explain the different possible options we had based on quality of the products and my budget. he wasn't pushy and made me feel real comfortable. next day i received an amazingly priced estimate and decided i was going to do it. him and an associate of his stopped by on the date we agreed on (on time) and knocked my whole home theater system out in less than 5 hours. what made my experience even better was the fact that he was more than willing to teach me how to use my brand new pioneer receiver. all and all they made my life a lot  more entertaining. i have to admit i did spent a bit more than i had initially planned but it was worth it. i will be calling them back for more stuff, highly a    recommended..."
5,"i have worked with jeremy at elite a v numerous times he is very particular clean and does excellent work. they do everything at 100 , never cut corners, very knowledgeable, polite, and honest. i recommend them to anyone!!"
5,"jeremy is a great worker, very knowledgable and honest. such quality work for the price too! i highly recommend elite av."
2,"wished it was better..
after watching man vs. food i decided to stop by, d  cor was not that homey and welcoming, and the neighborhood was bad, but nothing i haven't been around before.  the ribs were very fatty and grisly, it was disappointing and i didn't get enough sauce and when i asked for a little more they wanted to charge me, the coleslaw was awesome!  i noticed a hair in my food and it turned me off to the rest of it, so i threw it away , i wont be returning...
sorry guys"
2,"i've been going to hot sauce williams for the past 15 years and this place is going down hill big time!  the service continues to get worse and the attitude of the workers is piss poor.  they ignore you and can be very rude as well.  also, the place is very dirty and i would love to see the health inspection report.  

i will admit there sauce is some of the best i have ever had.  the wings are just not as good as they used too, but the polish boy is still very good.  the mac n cheese is very overrated and do not order the ribs.  they are like chowing down on a gristled piece of fat and that has the texture of rubber.  my friend tossed them away they were so bad.  

very sad to see an cleveland institution goes down the tubes like this and hope they can improve but that's the last they have seen of my business.  

p.s don't even bother going through the drive thru unless you have 20 mins to spare, no joke."
4,"i have been going here for at long time and its one of few places i can overlook bad service because i love the food. the wings are great, best wings in cleveland but the best offering from here is the barbeque sauce. better service and it would be 5 stars."
4,"i know others have been moaning about their service, but our experience last sunday was great. 

we were disappointed about the dining room being closed, but the drive through was open and the staff were very patient with our endless debate about what to order (our son can be finicky). they even chimed in with recommendations when they told us that fried okra was unavailable.

the food was incredible    and really messy in the car as we scarfed it down on our way back to nyc. we had polish girls, mac and cheese, black eyed peas and a pork shoulder sandwich. the sauce is really special. 

we strongly recommend it to everyone. great food, great service, really cheap."
5,"forget about the place and service (which were fine) and let's talk about the food!  the polish boy was good, but the fried chicken was amazing!!  and the sauce was killer!"
4,"hot sauce williams is definitely a guilty pleasure of mine  ) my favorite dish from here is the fried chicken and ribs dinner. for sides, i get the sweet potato fries and mac and cheese. they give you sooooo much food for just under  12! 

the servers work only behind the food stand, so you pretty much have to clean off the tables yourself. you may at first be deterred from this place by its lack of cleanliness, but the food is so worth it!  one thing to keep in mind, they don't provide free water, but a bottle of water is only  1. 

definitely worth checking out!"
3,"all the shoppes at the palazzo are expensive. this is like the rodeo dr of california or oak street in the gold coast of chicago. it is not like at ceasar's forum shops where there is a lot more variety. 
i like to window shop here and wish for things i can not afford, but the sales people are very pleasant here. 
they offered water bottles while i shopped at tory burch's for a specific purse my daughter was raving about.
  also important to mention is i was almost swindled into buying some ""sea salt"" cosmetics from la savon. it's nothing more than the other cosmetics sold in kiosks throughout las vegas and elsewhere...i was curious how they managed to have an actual store front shop. the woman there tried to sell me 2 bottles of makeup first for  599, then went to  199 in a matter of minutes to get a sale. i flew out of there as quick as i could. thankfully my husband made some excuse to leave."
5,another one of my favorite places to shop in vegas. i love the huge victoria's secret!!! could spend entire day shopping here!
4,this gorgeous mall of shoppes in the venetian hotel in las vegas are pricey for sure but it's lovely to look at all the upscale items. there are a few shops here and there that won't break your bank   look for basin (a great little soap shop that has only one other location and that's in orlando) and fresh (great cosmetics) and other beauty stores. lovely restaurants and super clean throughout.
4,"on a couple of occasions, we strolled through the shoppes at the palazzo.  the assortment of high end brands was satisfactory, but it was not all inclusive.  for chanel, lv, or other high end stores, you have to go across the street to the mall.  the shoppes at the palazzo is well decorated with marble floors and other fine textures.  if you do not like to gamble and have the means to shop at high end stores, this place is for you.  as a result, we usually stick to the slot machines!"
4,"lovely lovely lovely. i spent some time at the tory burch store. bought some darling flats and nearly broke out into a huge sweat. man its hot in there. no air circulation at all. next was the michael kors store again. this store is much smaller than the one at the forum. huge burberry store with clothes, bags, shoes, scarves, everything. great selection. the chlo   store was amazing as well.  but let me tell you what did it for me was the christian louboutin store. beautiful selection. this mall is next to the canal where all the gondolas are. lovely area. the only thing was the floor plans of the stores were a little weird to follow."
