0,1
5,"three words for you...high end expensive. 

i can't give the shoppes at the palazzo any less than 5 stars because they market, advertise, and sell money.  that's their main goal.  put a bunch of high end stores together and make money.  since they accomplish their goal, you can't fault them for it.  when it comes to expensive goodies, might as well set it up correctly and at one of the more classier casinos like the palazzo.  all the stores are maintained, clean, and have some of the best service ever, like ever.  

i've only been here a half dozen times and never bought anything due to my wine taste beer budget.  but i can tell you one thing, you're never stereotyped here, you're never treated like you don't belong, and you're never more than a minute in a store without great service.  my issue...i just can't justify some of the expenses.  if i ever hit the ca lottery (2, 23, 45, 55, 8, mega 13) then you may finally find me here not window shopping, but actually getting something. 

the shoppes at the palazzo   "
4,"te cafe has an extensive selection of teas including dozens of green and black teas as well as a few other variations  you can also order coffee, hot chocolate, and pastries. in terms of ambiance, it is one of the coziest establishments that i have been in making it an ideal place to read, study, or complete some work. it's also a nice venue to meet up with a friend for a pot of tea and some quiet conversation. there are also some board games (including chess, backgammon, and dominoes among several others)"
5,"went here with my girlfriend and really enjoyed this place. great atmosphere. i'm not that into tea, but i had a couple cups from the pot my gf ordered and enjoyed it. we ordered 2 biscotti, a medium coffee and a pot of tea (which comes with a free refill) and it cost just over  7. the barista was really nice and helpful."
1,"i came in for the first time, sat down to setup my computer, and within 2 minutes had a server telling me that if i do not order anything i will have to leave. i'm not sure if i was being judged by the way i looked (wearing sweatpants and ratty t shirt), or if this is standard practice. i was planning on staying and purchasing a drink, but found this treatment extremely rude and uncomfortable. do not plan on returning."
4,"aw, i love it. it looks like a really great study area. i would come here to study. also they give you a pot of tea with free hot water refills. that would be perfect for studying. also, the guy working there was really helpful with suggestions. and the place inside is just super chill."
4,"i've been shopping at this mall since i was a child and in the last couple years they've really outdone themselves by doing a total makeover and renovation. the whole interior is a lot more trendy and reflective of our times and the big name brands and boutiques that have settled in the mail.
everything is a glossy white marble, clean and sleek.  lots of natural sunlight coming from glass rooftop openings. the food court is also impressive, they've expanded the seating area by shutting down one of the stores on the side. color combination and lighting makes this place a whole lot more appealing.

since the building of the dix 30 mega outdoor shopping lifestyle complex, mail champlain has had to renew itself to retain shoppers. the opening of the forever 21 store was one of their best moves. they also appeal to a higher class of shoppers with big brands like bcbg and browns shoes. even the bay has undergone a slight revamp   on the main floor, they've rearranged their handbag and shoe department to make way for name brands.

i used to see mostly elderly people wandering around during the week, it didn't seem like a popular hangout place for youngings but that has changed.

mail champlain has a bit of everything for all ages, tastes and budgets. the only thing missing might be a pharmacy, they used to have a jean coutu but it closed down."
3,"menu is short. excellent black bean veggie burger and seasoned waffle fries.  old fashioneds are made from scratch muddled.  i had excellent service while there  nice, competent bartender came outside to refill drinks several times.  it was a comfortable experience, relaxing outside watching the waves.  veggie people beware taxidermied animals inside."
4,"i'm very surprised to read all the negative reviews. we were made to feel very welcome as soon as we sat at the bar by tim the bartender. he was unfailingly polite and friendly, as were the people who sat near us. it made me wish we had more time to hang out and soak up the lovely waterfront location. 

starving, we ordered a pizza and both enjoyed enjoyed the hell out of it. the toppings tasted very fresh and the crust had a slight flakiness to it. the only drawbacks i can think of are the plastic cups the beer is served in and that i'd love it if another taphandle were devoted to something a bit more local to madison, like ale asylum, karben4, or even tyranena (from lake mills).

as we left tim thanked us for stopping in and asked us to come back the next time we were nearby. i 100  plan to do so."
1,"worst service ever. we arrived at 7 pm on a friday night. since it's on the lake, were not surprised there was a wait, but didn't really seem to be enoughpeople waiting for 1 1 2 hour wait.  we sat on the deck with a couple of drinks, and enjoyed that. at the 1 1 2 hour mark, went in to see how much longer and were shocked to see the mostly empty dining area in the bar. maybe the upstairs dining was busy? nope  one table of 4 waiting to be served, and 2 large tables of people who had finished eating and were doing their party speeches. we think they just forgot us.
brief wait for the waitress.10 minutes later got our salads for 2 of us, soup for 2  (husband wanted cole slaw, but they were out). soup was good. salad was very small, with a huge carrot 'coin' and cucumber slice. italian dressing was blah, bleu cheese dressing had no bleu cheese chunks.
30 minutes later, caught the attention of our oblivious waitress to check on the status of our order, and her comment was ""didn't they tell you it would be an hour wait?"" wouldn't that be the waitress' job? after another 20minutes, and the 1 hour mark, i went to find a manager. bartender blew me off, so i went to find the host,who apologized, said it was coming out now, and said they ""were just catching up"". from what? the bar area dining was almost empty, and we were still one of two 4 person tables up in the big dining area.
5 minutes later, with no waitress, no food, we left. we will not be back. maybe the food is good, can't comment on that, but the aggravation is not worth it."
5,"today i had another session with les.  i was having so much pain in my foot i thought i was going to have to give up dance.  les did a combination of multiple modalities on me including lymphatic drainage, chiropractic massage, russian massage to realign my leg and foot.  i was very relaxed and even when he had to use more pressure on the reflexology, it was fine.  he diagnosed that i had a tight inner thigh muscle and he got it to release.  les is so experienced and can read your body and diagnose where your physical issues are.  i am telling all my friends about his work!"
5,"i work in a office building right around the corner from them.  the place is small, but once you find it, you'll keep coming back.  honest to god, the food is addictive.  my faves are the italian hoagie (reminds me of home back east) and the chipotle chicken sandwich.  and i also enjoy their flavored iced tea to go along with it.

staff is friendly too which makes the experience even better!

i'm a fan!"
5,"an excellent place for lunch, the food is great the service too! always friendly, never pushy, as one guy said, i like the 'tude of the lounge lady...i call it the the lunch lizard and its off the beaten path but you wont go wrong with thier specials or anything on the menu for that matter. the outside seating is nice, i try to eat here regularly...beats any chain sammich shop!"
5,"what a find!  while staying at the aloft in phoenix for business we found this on a morning walk.   

we had the breakfast burrito and a breakfast panini.  both were excellent!  the burrito was so large we agreed that it could have fed us both.

the lunch menu looked great and i would like to try some of the sandwiches.

we are here for a few more days and will eat here on monday.

if you are staying at a hotel in this area be sure to give it a try for a good quick breakfast or lunch.  you won't be disappointed."
5,amazing lunch.  fresh boars head meats. fresh bread (marble rye is awesome) and tr staff is great.  one of the best sandwiches in the phoenix area.  don't miss this place. you won't be disappointed!
5,"was in phoenix for business and discovered this friendly, wonderful  haunt  near the airport.  i had the best lunch ever    a southwestern chicken chipotle panini.  omg!  the guy behind the counter turned out to be the owner, and himself grew up in a family owned east coast deli.  

i had several expensive meals during my trip, but nothing was as tasty as my lunch lounge experience!  i made sure i had time for a breakfast stop on my way back to the airport., and was again wowed with a huge breakfast burrito, great latte and a smile   all for less than my daily nyc latte and muffin.  

my  client has never been to the lunch lounge, so next time i am in town, we have a lunch date at the best undiscovered charming cafe in phoenix!  i can't wait to share the secret!"
2,"i visited this restaurant because i got a groupon now deal. when i walked in and the older woman standing there took about 5 minutes to acknowledge that i was standing there at the counter waiting to be served..

finally she said ""whenever your ready.."". i told her hi how are you, giving her a nice reminder that that is how your supposed to greet new customers in your establishment. that on its own turned me off because i hate giving my money away tobusinesses that don't appreciate me.  i don't feel like i am asking for much in exchange for coming back and supporting local businesses. 

as i was standing waiting for my food i overheard the employees (including my o so pleasnt serve lady) complaining about the groupons that kept coming in.. while i was standing there! rude! 

the older man behind the counter making sandwiches was very nice. he is the only reason i am giving two stars. 

the food on the other hand was decent. too bad i won't ever becoming back just to be treated like i am bothering them.. next time i will just eat mcdonalds breakfast like i wanted anyways."
3,"this is a nice spot for some of your caribbean needs.  you should definitely check it out at least once if you find yourself in the university area.

it's small and tucked away in the shopping center, but you visibly see the sign for the place.  the menu isn't that big, so you for sure will not be overwhelmed with too many choices.  i have gone here twice now and definitely recommend the goat curry or the oxtail meal.  i don't know about you, but when i ordered these, i also asked for extra gravy.  it was great to have the extra gravy with the rice and cabbage. note that when you order the meal, it doesn't come with a drink though.  kinda a bummer on that part. 

the place is alright, pretty small.  they have tables near the register, and also near the back.  i haven't been towards the back to see how many tables there are as i have only gotten take out.  the prices are a little pricey to me, but the food was worth it."
4,"food is great.  the service is average.  the prices are cheap so you tend to get idiots in there who have no manners.  i recommend, taking the food to go or sitting in the back."
5,"dont sleep on this spot! consistently great, authentic mexican food. we've tried many other places but continue to return here!"
2,"been here a couple of times and it was ok for most part. not spectacular. the food has been ok, but we've always had good service. returned last week with baby in tow, only to find no changing table in bathroom of this ""family"" friendly restaurant. not returning."
4,"i love the manager here, he knows us for a very long time. i like their food. the servers change so often that we don't like it but still they are much better than a lot of other restaurants.  

food   4 5
service   4.5 5
management   5 5"
4,"this place serves the pure vegetarian south indian cuisine .. even though i am not a pure vegetarian, i do eat out at this restaurant sometimes when i am in a mood for a light meal .. the thing with this kinda food is that no matter how much you eat, it doesn't makes your stomach go rumbling or feel heavy .. so i guess i can go here once in a while ..
the ambience isn't that great .. some of the tables are lined up in the middle of the path and i hate sitting in this area. the service is alright, not the fastest but reasonable . everytime i've been here, i've noticed that the place is kinda crowded .. so there is a lot of noise but then if i choose to eat out then i should not complain about the noise i guess.
food is good if you are not looking for the typical spicy taste that indian food is known for. their spice level is pretty low."
1,"i will never return to this place! they made us wait for 20 minutes even though there were rows of empty tables. then when seated, again another 15 minute wait and i had to ask to be served. we had a pretty simple order 2 people, 4 items. they managed to mess it up. food took forever to come and one item was missing. when i asked for the item the wait staff denied i had ordered it their computer clearly confirmed otherwise. the manager came by and said 'sorry we can't handle the crowd.' um...you're running a restaurant with a certain number of seats. what are you doing if you can't handle the customers? and to boot they offered us a free dessert (which we didn't want) but didn't take a penny off the bill. 
the food was mediocre. stay far far away from this place. i'm sure there are better places for a dosa craving."
4,"went for saturday dinner with 4 ppl.  very friendly and knowledgeable staff.  extremely clean!!!  love the hand washing station!!!  great service and fantastic food, however only gave 4 out of 5 stars for two reasons   (1) waiter forgot to bring our lassi (yet it was charged on the bill and we had to ask for it to be removed.. oh well, not too big a deal, it was an accident), and (2) the timing of bringing our dishes.  we ordered one appetizer to share, and four entrees.  one entree came first, several minutes later the appetizer came, and then several minutes later second entree, and several several minutes later the third entree, then much later the last entree came.  it wasn't ideal for us to be eating one at a time, lol.  this is a great restaurant to try if those two things don't bug you  )"
5,"great place if you want to taste real south indian food. great customer service. the food was tasty, specially their special meal with different curries and rice. so far i have had very experience with this place after several visits."
1,today i went to sarvana bhava with my family at scarborough location this is one of the worst sevice i got i went with my infant baby (i had requested a seat in corner for my baby but the waiter was very rude he was more interested in accommodating other guest though place was relatively empty) and the service was pathetic. waited half an hour for tandoori paratha after finishing fist one and which never camei wont recommend this place for anyone
5,it's inside the mall and the food is awesome! probably the best authentic chinese dinner you can have on christmas eve in north carolina. just don't peek in the kitchen. you're all good.
4,"it helps to have someone understand the language while in the hong kong bbq, but they do have english menus that you can use on the counter.  it is pretty cheap for some good food.  just ignore the pig hanging from the ceiling if you find that gross and also ignore the food rating as i survived my visit and i am sure you will yours.  just make sure to wipe down your silverware when you get them.

personally i really liked the bbq pork which you can see hanging with all the meat in little strips  which, they cut up and serve with rice is really good."
5,i love this place! kenny is awesome! the owner is super cool and friendly. i have been coming here for 4 years and i would never go anywhere else. it's nice and clean and bright and open. i have been getting my nails done for 18 years and this is by far the best nail salon i have been to.
5,"love this nail salon. i read the reviews on yelp and decided to try.  each experience has been positive, i've been going every 2 3 weeks since march.  i generally get a pedicure and gel manicure.  i haven't had the same technician twice but i always walk out happy with my nails and toes and get loads of compliments.  

the have great selection of gel  shellac  gelish polishes, can almost always find colors that match the regular polish near perfectly. prices are good, they have different pedicure choices you can add on and different types of pedicures to encompass all their different services. 

go during the week!  their weekends are insanely busy, you will have to wait and your services are good, but much better during the week.  that being said they like to take their time during the week.  sometimes its helpful to let them know you have a bit of a time crunch.  (my last gel manicure and pedicure i was there for just over 90 minutes)  i appreciated the time and enjoyed the break, but i know sometimes that much time is too much to spare."
5,"i recently moved to this salon after 5 years somewhere else that was close by. this salon is great. great prices, very clean and great service. the techs dont sit on their phone the entire time you are there  ) i will be ditching the other salon and using this place from now on! great find. highly recommend!"
5,"first time at fancy today. walk in appointment and i got sat immediately with ha. she was very good! very clean and quick technique. the salon is very nice and welcoming...they offer coffee, water, etc. i recently moved to the area and will definitely be back!!"
4,"went on a whim while running errands and i was helped right away. the salon was very clean and the chairs comfy. the staff was friendly and though it was busy it was fairly quiet so i felt i could relax. basic mani pedi for  34, not too bad! will be visiting again!"
5,"love this salon. kim is very friendly and did a really nice job on my mani and pedi. the owner runs a very tight ship and not very many people are talking, it's very quiet, the staff are very attentive and it's very relaxing. the place is very very clean. i will make this my nail salon now, it's reasonable, friendly, clean and relaxing, what more could you want?"
4,"needed a new nail place closer to my house so went here on a whim. i went on a wed afternoon so was pretty quiet and they were able to get me in right away. pedicure was very nice, massage was long, they offered me a bottle of water, normal prices, clean place, and friendly staff. my only complaint was they didn't have me sit under the lamp to dry so after i got home i noticed one if my toes was smeared. luckily i brought my own polish so i could touch it up. i will be going here again."
5,thank you yelpers!! i found also found this place to be awesome!! clean and lots of gel colors and glitter to choose from. ill be back there for sure!!
2,"my gf and i ate at fin's on saturday night sept 21, 2013.  we had the chef's special tasting box which had 9 different items. the honey topped eggplant was quite good but everything else was mundane at best.  there were rubbery little pieces of octopus with much chopped vegetables in a sauce that overwhelmed everything. there was spicy salmon which was not spicy and was overwhelmed by a massive amount of mayo.  the tuna was tasteless. etc. in addition, the decor is primitive and the place is incredibly loud for a supposedly upscale restaurant. it is simply not a good restaurant and i would not return."
4,"what a gem! i'm so happy i wandered into fin! 

since moving to oakville i've been searching for as many toronto esque restaurants as possible so i can get my fill! i've found a few great places there, but no food (especially asian) has actually been that great   until fin! 

i went here on a sunday evening, and was concerned it wouldn't be open, but it was until 10 pm. we were greeted in japanese and seated immediately by our extremely friendly and attentive server. 

food is a bit on the pricey side, but without there being much competition in terms of izakaya in oakville, i wasn't surprised, and it didn't break the bank. 

personal favorites were the selection of fish for three (see picture, so beautiful!) and the eastern style caesar (who wouldn't love a drink with a crab leg in it!).

overall i was super impressed with the quality and variety of food, as well as the service. i couldn't recommend fin enough to those starved for a bit of asian food in oakville!

disclaimer  if you're from toronto and eat izakaya all the time, this might be a touch pricey for you!"
4,"exceeded expectations. ate early around 6.15 pm so was fairly quiet...2 others. strangely asked if we had reservations...interesting! 
sauvignon blanc from chile was good and can be recommended. cucumber addiction tasty, avocado tempura very good, sashimi 3 kinds flawless, fresh raspberry point fresh oysters excellent value at  1.50 each. shichimi duck salad also very good.  at  76 before hst   tip about right for the quality. pleasant staff....will go again!"
4,"fairly new establishment on the lakeshore strip in downtown oakville.  a good thing to see with all the for lease signs that have been cropping up lately.

if someone could translate what is yelled at patrons once they enter, it would be greatly appreciated.  i'll assume it is a greeting.  the friendly staff that helped us explained that the general restaurant experience is that of arriving, eating and then leaving to go enjoy something else, somewhere else.  the izakaya experience is designed for you to eat, drink, socialize, etc. all under one roof.  hence the loud and sometimes frantic atmosphere.  pretty much a tapas menu.

after perusing the sake menu, my wife and i settled on some sapporo, mine in the bath sized glass.  it wasn't that the sake menu wasn't impressive, but my wife doesn't love it, i have limited experience with the gekkeikan brand and i just wasn't in the mood to take a chance on a 3 oz,  15 30 sake that i may or may not like.  maybe if i'd have been encouraged or had some sort of crash course i would have considered.

any way, food 

in absence of a bread basket, you are given what is called thin spaghetti, coated in salt and flavoured with a spicy curry.  a little strange a different as it is like eating spicy uncooked spaghetti.  

started with the cucumber addiction   sliced pickled cucumber with sesame seed and oil.  a great clean tasting starter.  all orders come out fast and furious, but staggered so as not to bung up the table too much.

the pork rib kakuni was really good.  3 fall off the bone pork ribs that are slow braised and served on mashed potato with a spicy mustard for more flavour.  this was really tasty and a good portion of meat for only 3 pork ribs.

the soy bean cream crab croquette is a mouthful.  resembling arancini balls, but stuffed with crab, there 3 little guys are filling and have more substance to them than your average crab dish.

the tuna carpaccio is delicious with a savoury mixture coating the fish.  a little tricky to pick up with the chop sticks, as it is chopped rather finely, but worth the effort.

the deep fried prawns are quite massive and heavy on the garlic, but the spicy sauce make 'em quite a lovely plate and pretty to look at once delivered.

as the evening progresses, more and more residents of oakville filter in.  there is a lot of bumping and jockeying for room in this narrow little space.  conversations can be heard from basically every table.  the fake chested table were amazed when barbie's shorter sister came in, no less than one month after giving birth and back to her fighting weight.  a quick cat walk, a twirl and they're sat beside us.  yaaaaay.

this is where service fell apart.  we had one more order coming and we were contemplating another round of drinks and possibly dessert.  but with all the air kissing going on and the place getting louder and packed, the person taking our orders came back to our table after 15 20 minutes, stating that he'd forgotten to enter our last dish.  another 20 minutes later and the special of the night cod we'd ordered arrived.  it was incredible and naturally buttery.  any aggressive thoughts were forgotten instantaneously.


food for thought   if you come for the special catches of the day, come early.  4 of the 6 fish specials were sold out by 7 30.  and the blowtorch mackerel?  it may be delicious but smells of burnt arm hair.  maybe its just me and my wacky palette.

hopefully the ""trendiness"" wears off in the passing months.  the food is quite good and staff are helpful, sincere and very knowledgeable with the menu.  it is the clientelle that i could do without."
